[
  {
    "tool": "fetch_blog",
    "needs_approval": false,
    "reason": "Need source article before repurposing",
    "payload": {
      "url": "https://www.abhishekpanda.com/blog/agentic-ai-patterns"
    }
  },
  {
    "tool": "preview",
    "needs_approval": false,
    "reason": "Generate drafts for review",
    "source_refs": [
      "https://www.abhishekpanda.com/blog/agentic-ai-patterns"
    ],
    "payload": {
      "platforms": ["LinkedIn", "X", "Telegram"],
      "content": "Agentic AI architecture notes with reliability guardrails"
    }
  },
  {
    "tool": "create_task",
    "needs_approval": true,
    "reason": "User asked to create implementation tasks",
    "payload": {
      "title": "Prepare OpenOwl release checklist",
      "description": "Create rollout checklist with QA and approval gates",
      "priority": "high",
      "owner": "Abhishek Panda",
      "due_date": "2026-03-05"
    }
  },
  {
    "tool": "publish",
    "needs_approval": true,
    "reason": "External action",
    "source_refs": [
      "https://www.abhishekpanda.com/openowl"
    ],
    "payload": {
      "platform": "LinkedIn",
      "content": "OpenOwl Admin Center is now live with safety-first publishing controls.",
      "schedule_at": "2026-03-03T12:30:00.000Z"
    }
  }
]
